"DESCRIPTION","DURATION IN MS","NAME","PARENT SUITE","START TIME","STATUS","STOP TIME","SUB SUITE","SUITE","TEST CLASS","TEST METHOD"
"","12922","should be able to add expenses in various ways and cancel them","","Mon Jun 30 18:03:32 CEST 2025","passed","Mon Jun 30 18:03:45 CEST 2025","","Monefy allows to add expenses in various ways and incomes; all values calculated correctly on dashboard ","",""
"","20179","should be able to send money transfer from cash to card and balance will be updated on both sides","","Mon Jun 30 18:03:48 CEST 2025","passed","Mon Jun 30 18:04:08 CEST 2025","","Monefy allows user sending money from one type of account to another and balance updated successfully, user can switch between accounts ","",""
"","24461","should be able to send money transfer from cash to card and balance will be updated","","Mon Jun 30 17:30:05 CEST 2025","passed","Mon Jun 30 17:30:30 CEST 2025","","Monefy allows filter users expenses & incomes by different time ranges ","",""
"","8889","should be able to filter","","Mon Jun 30 18:04:11 CEST 2025","passed","Mon Jun 30 18:04:20 CEST 2025","","Monefy allows filter users expenses & incomes by different time ranges ","",""
"","12122","should be able to add income","","Mon Jun 30 18:03:20 CEST 2025","passed","Mon Jun 30 18:03:32 CEST 2025","","Monefy allows to add expenses in various ways and incomes; all values calculated correctly on dashboard ","",""
